base;titulo.x;ano.x;autores;desc_1;desc_2;link_de_acesso;link;titulo.y;temas;ano.y;local_defesa;instituicao;parser_usado;motivo_na
PROQUEST;Mitigating Cloud Computing Emissions at the National Level: Policy Responses and Carbon Accounting Methods for Carbon-Efficient Cloud Infrastructure Governance;2025;Soares, Ian Varela;NA;x;https://www-webofscience-com.ez87.periodicos.capes.gov.br/wos/pqdt/full-record/PQDT:161219081;https://www-webofscience-com.ez87.periodicos.capes.gov.br/wos/pqdt/full-record/PQDT:161219081;Web of Science;;NA;NA;;wos_proxy;NA
PROQUEST;Evaluation Education in a World in Transformation: The Way Forward;2023;Joppert, Marcia;x;NA;https://www-webofscience-com.ez87.periodicos.capes.gov.br/wos/pqdt/full-record/PQDT:88042514;https://www-webofscience-com.ez87.periodicos.capes.gov.br/wos/pqdt/full-record/PQDT:88042514;Web of Science;;NA;NA;;wos_proxy;NA
PROQUEST;Machine Learning and Critical Thinking: Applying Machine Learning Algorithms to the Scoring of the Critical Thinking Assessment Test (CAT);2020;Shanks, Kyle Wayne;x;NA;https://www-webofscience-com.ez87.periodicos.capes.gov.br/wos/pqdt/full-record/PQDT:67820433;https://www-webofscience-com.ez87.periodicos.capes.gov.br/wos/pqdt/full-record/PQDT:67820433;Web of Science;;NA;NA;;wos_proxy;NA
PROQUEST;The Theory and Practice of Critical Experiential Pedagogy: Enacting a Critical Experiential Education;2023;Thomas, Colleen A.;x;NA;https://www-webofscience-com.ez87.periodicos.capes.gov.br/wos/pqdt/full-record/PQDT:85146723;https://www-webofscience-com.ez87.periodicos.capes.gov.br/wos/pqdt/full-record/PQDT:85146723;Web of Science;;NA;NA;;wos_proxy;NA
PROQUEST;Parallel Minds: A Thematic Literature Review of Artificial Intelligence in Education;2024;Fanning, Sydney;x;NA;https://www-webofscience-com.ez87.periodicos.capes.gov.br/wos/pqdt/full-record/PQDT:122834947;https://www-webofscience-com.ez87.periodicos.capes.gov.br/wos/pqdt/full-record/PQDT:122834947;Web of Science;;NA;NA;;wos_proxy;NA
PROQUEST;Inside Ai: How Artificial Intelligence is Concentrating Power;2024;Kalluri, Pratyusha Ria;NA;x;https://www-webofscience-com.ez87.periodicos.capes.gov.br/wos/pqdt/full-record/PQDT:121106503;https://www-webofscience-com.ez87.periodicos.capes.gov.br/wos/pqdt/full-record/PQDT:121106503;Web of Science;;NA;NA;;wos_proxy;NA
PROQUEST;Learning to Teach with Technology: Interest Convergence, Identity, and Designing for Novice Teacher Critical Technology Literacy;2020;Gravell, Jamie Dara;x;NA;https://www-webofscience-com.ez87.periodicos.capes.gov.br/wos/pqdt/full-record/PQDT:66834396;https://www-webofscience-com.ez87.periodicos.capes.gov.br/wos/pqdt/full-record/PQDT:66834396;Web of Science;;NA;NA;;wos_proxy;NA
